{
  "schema_version": "1.0",
  "dataset_id": "rider-semantic-decision-pilot-v1",
  "dataset_sha256": "50154d8cf3c4efa9531d0dd5e1abfdb0e04e6fc9b9616f4b3c7505ffa8e4d8c2",
  "reviewer_id": "reviewer-a",
  "reviewed_at": null,
  "status": "draft",
  "instructions": "Complete independently without consulting provisional expected labels. Set one label and action per case, then change status to complete and add reviewed_at.",
  "labels": [
    {
      "case_id": "sim-cal-001",
      "label": null,
      "action": null,
      "intentional_refrain": null,
      "notes": ""
    },
    {
      "case_id": "sim-cal-002",
      "label": null,
      "action": null,
      "intentional_refrain": null,
      "notes": ""
    },
    {
      "case_id": "sim-cal-003",
      "label": null,
      "action": null,
      "intentional_refrain": null,
      "notes": ""
    },
    {
      "case_id": "sim-cal-004",
      "label": null,
      "action": null,
      "intentional_refrain": null,
      "notes": ""
    },
    {
      "case_id": "sim-cal-005",
      "label": null,
      "action": null,
      "intentional_refrain": null,
      "notes": ""
    },
    {
      "case_id": "sim-cal-006",
      "label": null,
      "action": null,
      "intentional_refrain": null,
      "notes": ""
    },
    {
      "case_id": "sim-cal-007",
      "label": null,
      "action": null,
      "intentional_refrain": null,
      "notes": ""
    },
    {
      "case_id": "sim-cal-008",
      "label": null,
      "action": null,
      "intentional_refrain": null,
      "notes": ""
    },
    {
      "case_id": "sim-cal-009",
      "label": null,
      "action": null,
      "intentional_refrain": null,
      "notes": ""
    },
    {
      "case_id": "sim-cal-010",
      "label": null,
      "action": null,
      "intentional_refrain": null,
      "notes": ""
    },
    {
      "case_id": "sim-cal-011",
      "label": null,
      "action": null,
      "intentional_refrain": null,
      "notes": ""
    },
    {
      "case_id": "sim-cal-012",
      "label": null,
      "action": null,
      "intentional_refrain": null,
      "notes": ""
    },
    {
      "case_id": "sim-hold-001",
      "label": null,
      "action": null,
      "intentional_refrain": null,
      "notes": ""
    },
    {
      "case_id": "sim-hold-002",
      "label": null,
      "action": null,
      "intentional_refrain": null,
      "notes": ""
    },
    {
      "case_id": "sim-hold-003",
      "label": null,
      "action": null,
      "intentional_refrain": null,
      "notes": ""
    },
    {
      "case_id": "sim-hold-004",
      "label": null,
      "action": null,
      "intentional_refrain": null,
      "notes": ""
    },
    {
      "case_id": "sim-hold-005",
      "label": null,
      "action": null,
      "intentional_refrain": null,
      "notes": ""
    },
    {
      "case_id": "sim-hold-006",
      "label": null,
      "action": null,
      "intentional_refrain": null,
      "notes": ""
    },
    {
      "case_id": "claim-cal-001",
      "label": null,
      "action": null,
      "intentional_refrain": "not-applicable",
      "notes": ""
    },
    {
      "case_id": "claim-cal-002",
      "label": null,
      "action": null,
      "intentional_refrain": "not-applicable",
      "notes": ""
    },
    {
      "case_id": "claim-cal-003",
      "label": null,
      "action": null,
      "intentional_refrain": "not-applicable",
      "notes": ""
    },
    {
      "case_id": "claim-cal-004",
      "label": null,
      "action": null,
      "intentional_refrain": "not-applicable",
      "notes": ""
    },
    {
      "case_id": "claim-cal-005",
      "label": null,
      "action": null,
      "intentional_refrain": "not-applicable",
      "notes": ""
    },
    {
      "case_id": "claim-hold-001",
      "label": null,
      "action": null,
      "intentional_refrain": "not-applicable",
      "notes": ""
    },
    {
      "case_id": "claim-hold-002",
      "label": null,
      "action": null,
      "intentional_refrain": "not-applicable",
      "notes": ""
    },
    {
      "case_id": "claim-hold-003",
      "label": null,
      "action": null,
      "intentional_refrain": "not-applicable",
      "notes": ""
    }
  ]
}
